{
  "$schema": "https://json-schema.org/draft/2020-12/schema",
  "$id": "audit_state.schema.json",
  "title": "Audit State",
  "type": "object",
  "required": ["status", "obligations"],
  "properties": {
    "status": {
      "type": "string",
      "enum": ["not_started", "active", "blocked", "complete"]
    },
    "last_executor": { "type": "string" },
    "last_obligation": { "type": "string" },
    "blockers": {
      "type": "array",
      "items": { "type": "string" }
    },
    "obligations": {
      "type": "array",
      "items": {
        "type": "object",
        "required": ["id", "state"],
        "properties": {
          "id": { "type": "string" },
          "state": {
            "type": "string",
            "enum": ["missing", "present", "stale", "blocked", "satisfied"]
          },
          "reason": { "type": "string" }
        },
        "additionalProperties": false
      }
    }
  },
  "additionalProperties": false
}
